{
  "show_id": 8381939,
  "type": "TV Show",
  "title": "Leslie Jones: Time Machine",
  "director": "Tod Philips",
  "cast": "Charlie Sheen",
  "country": "United States",
  "date_added": "10-Jan-20",
  "release_year": 2020,
  "rating": "TV-14",
  "duration": "1 Season",
  "listed_in": "TV Comedies, TV Dramas",
  "description": "When an 11 year old girl disappears...."
}